원본_제목,요약
"이 대통령, 6개 시군 특별재난 지역 선포 “재난에 음주가무 엄히 단속”","이재명 대통령이 경기도 가평과 전남 담양, 경남 산청 등 6개 시군을 특별재난지역으로 선포하고 엄정한 단속을 주문했다."
신경호 결심 공판 열려 검찰 “징역 3년 요구”,신경호 강원도교육감에 대한 결심공판이 어제22일 열렸는데   검찰은 징역형을 내려야한다고 주장했고   신경호 강원도교육감이 나타납니다.
‘계엄 옹호’ 강준욱 자진 사퇴 최동석 ‘2차 가해’ 발언 등 논란 확산,"강준욱 대통령실 국민통합비서관이 계엄 옹호 발언 등으로 결국 자진 사퇴했고, 최동석 인사혁신처장도 박원순 전 시장 사건을 두고 한 과거 발언이 2차 가해 논란에 섰다."
"이 대통령, 강선우 등 4명 청문보고서 재송부 요청","이재명 대통령은 국회에 강선우 여성가족부 장관 후보자를 포함해, 국방부와 국가보훈부, 통일부 장관 후보자에 대한 인사청문보고서를 내일까지 재송부해 달라고 요청했고  강유정 대통령실 대변인은 브리핑을 통해 이번주 내 임명을 마무리하고 신속한 국정 안정을 꾀하기 위해 기한은 오는 24일로 요청했다고 밝혔다."
6곳 특별재난지역 선포 “공직자 부적절 행위 엄히 단속”,"중앙재난안전대책본부는 경기 가평, 충남 서산 예산, 전남 담양, 경남 산청 합천을 집중호우 피해지역에 대한 사전조사를 토대로 대통령 재가를 받아 특별재난지역으로 우선 선포했다고 밝혔다."
